,Item ID,Title,Price,Condition,Description,Number_of_pictures,Delivery,Shipping,Distance,Ship_Location,Ship_Price,Location,City,State,Time
332,785792119,Iphone 7 Any carrier 128GB,260,Used (normal wear),Iphone 7 Red 128GBAny carrierGreat conditionTrusted Seller,10,Local pickup (24 miles away),No shipping INFO!,24.0,,,"San Diego, CA",San Diego, CA,6 days 
333,785761108,Apple iPhone 7 Plus 256gb no SIM tray,200,Other (see description),"Selling my iPhone 7 plus 256gb. Lost the SIM tray in the process of swapping the SIM, but they're cheap to replace. Phone is pending  unlock from AT&T and all requirements are fulfilled. Like new, no scratches,nicks or dings. Comes with a case as well. IMEI provided upon request. Buyer pickup in El Cajon. I just don't need it anymore, picking up an iPhone 11",5,Local pickup (15 miles away),No shipping INFO!,15.0,,,"El Cajon, CA",El Cajon, CA,6 days 
334,785585058,iPhone 7 128gb,200,New (never used),Just has one little crack on the screen and normal ware and tear on the back but has 128gb and it works fine I just decided to get a new phone,2,Local pickup (25 miles away),No shipping INFO!,25.0,,,"San Marcos, CA",San Marcos, CA,1 week 
335,785503698,iPhone 7 Plus replacement screen,100,Used (normal wear),iPhone 7  cracked screen can’t push home button to open don’t wanna bother to repair 100 or best offer also comes with a screen that you can attempt to switch out your self which has a crack at the top but the screen itself has no cracks. I’m unlucky with screens ,4,Local pickup (16 miles away),No shipping INFO!,16.0,,,"San Diego, CA",San Diego, CA,1 week 
336,785373631,iPhone 7 desbloqueado,200,Used (normal wear),Entregó sólo el celular!Crack en el vidrio templadoJala todo bienColor rosa32gb ,4,Local pickup (13 miles away),No shipping INFO!,13.0,,,"San Diego, CA",San Diego, CA,1 week 
337,785335080,Samsung Note 9 purple 128 gb,449,Used (normal wear),"Mint Condition Works With any AT&T , Tmobile, Verizon, Cricket, Metro Network and Overseas.We have in stock, iPhone 6 - $150  | iPhone 7 - $249  | iPhone 7 Plus - $349iPhone 8 - $349  | iPhone 8 Plus - $449 Samsung S8 - $249 |   S8 Plus - $349Samsung S9 - $349 |   S9 Plus  - $399Samsung Note 8 - $349  |  Note 9 - $449 Comes with warranty Call us or stop by  Our store address :Payless Wireless6074 EL Cajon Blvd San Diego, CA - 92115",10,Local pickup (11 miles away),No shipping INFO!,11.0,,,"San Diego, CA",San Diego, CA,1 week 
338,785307923,iPhone 7 32 gb unlocked,249,Used (normal wear),"Mint Condition Works With any AT&T , Tmobile, Verizon, Cricket, Metro Network and Overseas.We have in stock, iPhone 6 - $150  | iPhone 7 - $249  | iPhone 7 Plus - $349iPhone 8 - $349  | iPhone 8 Plus - $449 Samsung S8 - $249 |   S8 Plus - $349Samsung S9 - $349 |   S9 Plus  - $399Samsung Note 8 - $349  |  Note 9 - $449 Comes with warranty Call us or stop by  Our store address :Payless Wireless6074 EL Cajon Blvd San Diego, CA - 92115",6,Local pickup (11 miles away),No shipping INFO!,11.0,,,"San Diego, CA",San Diego, CA,1 week 
339,785304765,iPhone 8 plus 64 gb unlocked,449,Used (normal wear),"Mint Condition Works With any AT&T , Tmobile, Verizon, Cricket, Metro Network and Overseas.We have in stock, iPhone 6 - $150  | iPhone 7 - $249  | iPhone 7 Plus - $349iPhone 8 - $349  | iPhone 8 Plus - $449 Samsung S8 - $249 |   S8 Plus - $349Samsung S9 - $349 |   S9 Plus  - $399Samsung Note 8 - $349  |  Note 9 - $449 Comes with warranty Call us or stop by  Our store address :Payless Wireless6074 EL Cajon Blvd San Diego, CA - 92115",9,Local pickup (11 miles away),No shipping INFO!,11.0,,,"San Diego, CA",San Diego, CA,1 week 
340,785297718,iPhone 6 16 gb unlocked,150,Used (normal wear),"Mint Condition Works With any AT&T , Tmobile, Verizon, Cricket, Metro Network and Overseas.We have in stock, iPhone 6 - $150  | iPhone 7 - $249  | iPhone 7 Plus - $349iPhone 8 - $349  | iPhone 8 Plus - $449 Samsung S8 - $249 |   S8 Plus - $349Samsung S9 - $349 |   S9 Plus  - $399Samsung Note 8 - $349  |  Note 9 - $449 Comes with warranty Call us or stop by  Our store address :Payless Wireless6074 EL Cajon Blvd San Diego, CA - 92115",8,Local pickup (11 miles away),No shipping INFO!,11.0,,,"San Diego, CA",San Diego, CA,1 week 
341,785294431,iPhone 8 64 gb unlocked,349,Used (normal wear),"Mint Condition Works With any AT&T , Tmobile, Verizon, Cricket, Metro Network and Overseas.We have in stock, iPhone 6 - $150  | iPhone 7 - $249  | iPhone 7 Plus - $349iPhone 8 - $349  | iPhone 8 Plus - $449 Samsung S8 - $249 |   S8 Plus - $349Samsung S9 - $349 |   S9 Plus  - $399Samsung Note 8 - $349  |  Note 9 - $449 Comes with warranty Call us or stop by  Our store address :Payless Wireless6074 EL Cajon Blvd San Diego, CA - 92115",11,Local pickup (11 miles away),No shipping INFO!,11.0,,,"San Diego, CA",San Diego, CA,1 week 
342,785100617,iPhone 7,140,Used (normal wear),Selling my iPhone 7 unlocked for any carrier. 128gb clean iCloud only down fall is the cracked screen but everything functions regularly. Asking $140,5,Local pickup (37 miles away),No shipping INFO!,37.0,,,"Fallbrook, CA",Fallbrook, CA,1 week 
343,784565306,iphone 7,150,Used (normal wear),it works perfectly (boost and sprint) no cracks and no water damage the back camera dosent work i got scammed selling for 150 price is firm,3,Local pickup (15 miles away),No shipping INFO!,15.0,,,"San Diego, CA",San Diego, CA,1 week 
344,784951039,iPhone 7 32gb Unlocked,240,Used (normal wear),Great condition No issuesWorks perfectlyNo iCloudClean imei No charger,3,Local pickup (22 miles away),No shipping INFO!,22.0,,,"San Diego, CA",San Diego, CA,1 week 
345,784779019,Iphone 7 plus 256gb unlocked,290,Used (normal wear),Great condition unlocked256gb ,3,Local pickup (49 miles away),No shipping INFO!,49.0,,,"Mission Viejo, CA",Mission Viejo, CA,1 week 
346,784517576,Unlocked iphone 7 128gb,275,Used (normal wear),"Low ballers will be ignored and blocked Used in good condition, a few nicks/scratches but no cracks.UnlockedNo icloud Find my phone is turned off.Works on Tmobile, Verizon and AT&T (might work on sprint)Comes with box, and charger.Local deals only. Asking $275 or best.",1,Local pickup (26 miles away),No shipping INFO!,26.0,,,"San Diego, CA",San Diego, CA,1 week 
347,784327668,IPhone 7 brand new unlocked,250,New (never used),"iPhone 7 and it will work at any carrier, still wrapped in plastic. ",2,Local pickup (42 miles away),No shipping INFO!,42.0,,,"Temecula, CA",Temecula, CA,1 week 
348,784219597,iPhone 7 UNLOCKED 128 GB,250,Reconditioned/Certified,iPhone 7 UNLOCKED for all carriers. It has an outstanding memory of 128GB; there’s only a limited supply for these devices. We’re a store located in Linda Vista that specializes in high quality electronics. ,4,Local pickup (8 miles away),No shipping INFO!,8.0,,,"San Diego, CA",San Diego, CA,1 week 
349,789153905,Iphone 7,120,Used (normal wear),Rose gold32GBBoost mobile/SprintNothing lower than $110,4,No delivery INFO!,"Ships from Calumet City, IL for $7.49",,"Calumet City, IL",7.49,"Calumet City, IL",Calumet City, IL,2 hours 
350,784070095,"iPhone 7 Plus Rare (Product)Red 128Gb(Unlocked)All Carriers TMobile MetroPcs,AT&T🇲🇽 chip Telcel",370,Used (normal wear),"iPhone : 7  plus Color :  RedStorage : 128 Carrier : (Unlocked all carriers)ESN/IMEI : CLEANICLOUD: (unlocked)  Beautiful  Red128 Gb storage iCloud (UNLOCKED)all carriers AT&T T-Mobile Verizon, Obama sim, Metro pcs ,Cricket,Sprint, any country 🇲🇽 MEXICO Telcel Movistar everything fully functional No (cracks) speakers, cameras, buttons no issues  great for Gift .buy with confidence as we sell daily on here family owned shop.30 day warranty .phone will come with charger seen in picture box if requested..good seller good reviews) serious buyers only PLEASE!!",10,Local pickup (19 miles away),No shipping INFO!,19.0,,,"Chula Vista, CA",Chula Vista, CA,1 week 
351,784054576,iPhone 7 Plus boost Mobile,300,Used (normal wear),iPhone 7 Plus Boost Mobile ,1,Local pickup (14 miles away),No shipping INFO!,14.0,,,"Lemon Grove, CA",Lemon Grove, CA,1 week 
352,784014903,iPhone 7 180g unlocked,250,Open box (never used),Like new ,3,Local pickup (18 miles away),No shipping INFO!,18.0,,,"Chula Vista, CA",Chula Vista, CA,1 week 
353,783967375,iPhone 7 unlocked | Store | Warranty,249,Used (normal wear),"Mint Condition Works With any AT&T , Tmobile, Verizon, Cricket, Metro Network and Overseas.We have in stock, iPhone 6 - $150  | iPhone 7 - $249  | iPhone 7 Plus - $349iPhone 8 - $349  | iPhone 8 Plus - $449 Samsung S8 - $249 |   S8 Plus - $349Samsung S9 - $349 |   S9 Plus  - $399Samsung Note 8 - $349  |  Note 9 - $449 Comes with warranty Call us or stop by  Our store address :Payless Wireless6074 EL Cajon Blvd San Diego, CA - 92115",7,Local pickup (11 miles away),No shipping INFO!,11.0,,,"San Diego, CA",San Diego, CA,1 week 
354,783965544,iPhone 8 plus unlocked | Store | Warranty,449,Used (normal wear),"Mint Condition Works With any AT&T , Tmobile, Verizon, Cricket, Metro Network and Overseas.We have in stock, iPhone 6 - $150  | iPhone 7 - $249  | iPhone 7 Plus - $349iPhone 8 - $349  | iPhone 8 Plus - $449 Samsung S8 - $249 |   S8 Plus - $349Samsung S9 - $349 |   S9 Plus  - $399Samsung Note 8 - $349  |  Note 9 - $449 Comes with warranty Call us or stop by  Our store address :Payless Wireless6074 EL Cajon Blvd San Diego, CA - 92115",12,Local pickup (11 miles away),No shipping INFO!,11.0,,,"San Diego, CA",San Diego, CA,1 week 
355,783901116,iPhone 7- $150 firm,150,Used (normal wear),Selling iPhone 7.  Has a slight cracked screen for $150 firm,2,Local pickup (9 miles away),No shipping INFO!,9.0,,,"San Diego, CA",San Diego, CA,1 week 
356,783882216,iPhone 7 plus 32 gb unlocked,349,Used (normal wear),"Mint Condition Works With any AT&T , Tmobile, Verizon, Cricket, Metro Network and Overseas.We have in stock, iPhone 6 - $150  | iPhone 7 - $249  | iPhone 7 Plus - $349iPhone 8 - $349  | iPhone 8 Plus - $449 Samsung S8 - $249 |   S8 Plus - $349Samsung S9 - $349 |   S9 Plus  - $399Samsung Note 8 - $349  |  Note 9 - $449 Comes with warranty Call us or stop by  Our store address :Payless Wireless6074 EL Cajon Blvd San Diego, CA - 92115",7,Local pickup (11 miles away),No shipping INFO!,11.0,,,"San Diego, CA",San Diego, CA,1 week 
357,783818502,Samsung galaxy S8 unlocked - excellent condition,249,Used (normal wear),"Mint Condition Works With any AT&T , Tmobile, Verizon, Cricket, Metro Network and Overseas.We have in stock, iPhone 6 - $150  | iPhone 7 - $249  | iPhone 7 Plus - $349iPhone 8 - $349  | iPhone 8 Plus - $449 Samsung S8 - $249 |   S8 Plus - $349Samsung S9 - $349 |   S9 Plus  - $399Samsung Note 8 - $349  |  Note 9 - $449 Comes with warranty Call us or stop by  Our store address :Payless Wireless6074 EL Cajon Blvd San Diego, CA - 92115",11,Local pickup (11 miles away),No shipping INFO!,11.0,,,"San Diego, CA",San Diego, CA,1 week 
358,783717842,iPhone 7 Plus 32 GB,350,Used (normal wear),"Almost new Apple iPhone 7 Plus white with Rose Gold, 32GB, no defects, no scratches, no damage, T-Mobile service carrier, NO TRADES, NO DELIVERIES, NO SHIPPING, WILL MEET AT STORE ONLY",2,Local pickup (10 miles away),No shipping INFO!,10.0,,,"San Diego, CA",San Diego, CA,1 week 
359,783656603,AT&T iPhone 7,125,Used (normal wear),Works perfectly fine. There’s a crack in the front screen. Iphone is priced to sell. 32gb at&t Iphone. $125 ,3,Local pickup (11 miles away),No shipping INFO!,11.0,,,"San Diego, CA",San Diego, CA,1 week 
360,783527560,iPhone 7 32GB (UNLOCKED)T-Mobile MetroPCs 🇲🇽 MEXICO CHIP AT&T Verizon Cricket sprint,250,Used (normal wear),iPhone :   iPhone (7)Storage :  32Gb Carrier : (Unlocked)AllColor :     SilveriCloud : Unlocked  ESn : CleanPhone is in good condition fully functional speakers cameras buttons no issues at all no cracks at all on the  LCD . 32 gb asking 250$I also have Matte- black 🌹 Gold/Jet-Black Gold ask .serious buyers please as we sell daily on here .. come with chargers,9,Local pickup (18 miles away),No shipping INFO!,18.0,,,"Chula Vista, CA",Chula Vista, CA,1 week 
361,783471847,iPhone 7 Plus,350,Used (normal wear),128 gb T-Mobile carrier no scratches ,4,Local pickup (23 miles away),No shipping INFO!,23.0,,,"San Diego, CA",San Diego, CA,1 week 
363,783428915,TRADE TO UPGRADE // Surface Laptop 1 8/256 (see details),600,Open box (never used),Looking to trade the Surface laptop and iPhone XS Max sprint only 64g FORSurface laptop 3 or Surface Pro X or 7 with equivalent specs ,4,Local pickup (6 miles away),No shipping INFO!,6.0,,,"San Diego, CA",San Diego, CA,1 week 
364,783337636,iphone 7 plus 32g not broken nothing wrong,350,Used (normal wear),the phone works well. nothing is wrong with it. not broken ,4,Local pickup (14 miles away),No shipping INFO!,14.0,,,"Lemon Grove, CA",Lemon Grove, CA,1 week 
365,783315703,IPhone 7 Plus 128gb carrier unlocked,325,Used (normal wear),"Pick up in Carlsbad I don’t driveEverything works great  Clean IMEI, no iCloud lock Feel free to test before you buy Willing to take $$ off for certain iPhones working broken or iCloud locked  ",3,Local pickup (13 miles away),No shipping INFO!,13.0,,,"Encinitas, CA",Encinitas, CA,1 week 
366,783229595,"iPhone 7, 32gb, Verizon, with charger",180,Used (normal wear),Got a new phone and don’t need this one. Works fine ,4,Local pickup (10 miles away),No shipping INFO!,10.0,,,"San Diego, CA",San Diego, CA,1 week 
367,783168229,iPhone 7 PARTS ONLY,100,For Parts,Gold back - Barely any scratches Front screen crackedHas everything else you would want to use for parts,3,Local pickup (26 miles away),No shipping INFO!,26.0,,,"Escondido, CA",Escondido, CA,1 week 
368,783038859,iPhone 7 128GB (Unlocked),200,Used (normal wear),"Just happened to upgrade so I’m selling my old iPhone 7 128GB. Great phone, lots of storage.Unlocked now, just needs a new SIM card from your choice of service. Check last picture, small scratch only seen in various lighting. Charging box, no cord. ",7,Local pickup (5 miles away),No shipping INFO!,5.0,,,"San Diego, CA",San Diego, CA,1 week 
369,782822854,Unlocked Brand new iPhone 7 32g.,200,New (never used),Brand new i phone 7 32 g. With case. Unlocked for any network ,2,Local pickup (16 miles away),Ships for $3.29,16.0,,3.29,"Spring Valley, CA",Spring Valley, CA,1 week 
370,782545560,iPhone 7 Plus *unlocked*,200,Reconditioned/Certified,Still look brand new and it’s unlocked ,2,Local pickup (15 miles away),No shipping INFO!,15.0,,,"San Diego, CA",San Diego, CA,1 week 
371,782352292,iPhone 7 Plus 128g Unlocked,450,Used (normal wear),"I’m selling my wife’s previous iPhone 7 Plus, Rose gold, 128gb of memory Unlocked Model A1661 Global phoneWorks great for any carrierBought it in full price at Apple StoreIncludes: Box, charger, EarPods and Case$450 cash and pick up only ",4,Local pickup (24 miles away),No shipping INFO!,24.0,,,"Vista, CA",Vista, CA,1 week 
373,782056249,"iPhone 7, unlocked for any carrier, comes with the case, 32 gb",Sold!,Used (normal wear),No description. Ask seller for more details,2,Local pickup (23 miles away),No shipping INFO!,23.0,,,"Chula Vista, CA",Chula Vista, CA,1 week 
374,781952385,Iphone 7 32gb sprint,200,Other (see description),I have my old iphone 7 up for sale in good working condition. Sprint. 32 gb. ,2,Local pickup (21 miles away),No shipping INFO!,21.0,,,"Imperial Beach, CA",Imperial Beach, CA,1 week 
376,781659174,iPhone 7 plus,280,Used (normal wear),iPhone 7 plus unlocked 32GB,3,Local pickup (12 miles away),No shipping INFO!,12.0,,,"San Diego, CA",San Diego, CA,2 weeks 
377,781524756,NEW IPHONE 7 NEW NEW,240,New (never used),"IPHONE 7 for sale!!$240Includes month bill, phone, taxes. FREE TEMPER GLASS AND CASE!!! YES FREE FREE!! ",1,Local pickup (11 miles away),No shipping INFO!,11.0,,,"San Diego, CA",San Diego, CA,2 weeks 
378,781450635,iPhone 7 32GB Carrier(UNLOCKED)TMobile MetroPCs 🇲🇽 MEXICO Telcel Chip AT&T Verizon Cricket sprint,250,Used (normal wear),iPhone :   iPhone (7)Storage : 32Gg Carrier : (Unlocked)AllColor :  🌹gold iCloud : Unlocked  ESn : CleanPhone is in good condition fully functional speakers cameras buttons no issues no cracks . 32 gb asking 260$i also have  Jetblack ask and other colors ask serious buyers please as we sell daily on here .. come with chargers.,6,Local pickup (19 miles away),No shipping INFO!,19.0,,,"Chula Vista, CA",Chula Vista, CA,2 weeks 
379,781219830,SWITCH & GET IPHONE 7,240,New (never used),BRAND NEW WITH SERVICE TAXES AND CASE/TEMPER GLASS INCLUDED 5406 el cajon blvd san diego CA ,5,Local pickup (11 miles away),No shipping INFO!,11.0,,,"San Diego, CA",San Diego, CA,2 weeks 
380,781131612,Garmin Dash Cam 45 Pawn Shop Casa de Empeño,120,Used (normal wear),"Garmin Dash Cam 45.   Works perfect and is in excellent condition.   Any questions iPhone 7 32GB for Boost or Sprint.  Works perfect and is in mint condition.   Any questions please call or come in and see it  @ TRI CITY PAWN TRI CITY PAWN546 S. Santa Fe Ave	Vista, CA 92084Hablamos espanolM-F 10am-5:30pmSAT 10am-3:30pmSUN CLOSED  please call or come in and see it  @ TRI CITY PAWN TRI CITY PAWN546 S. Santa Fe Ave	Vista, CA 92084Hablamos EspañolM-F 10am-5:30pmSAT 10am-3:30pmSUN CLOSED ",6,Local pickup (23 miles away),No shipping INFO!,23.0,,,"Vista, CA",Vista, CA,2 weeks 
381,781082997,iPhone 7 Plus 128gb UNLOCK any carrier,300,Reconditioned/Certified,unique detail cracked screen everything else perfectly serves EVERYTHING,5,Local pickup (22 miles away),No shipping INFO!,22.0,,,"San Diego, CA",San Diego, CA,2 weeks 
382,780909809,Apple iPhone 7 128gb,200,Used (normal wear),Selling my Apple iPhone 7 128gb. Phone works except the camera was having issues when trying to zoom in. Got the new phone so don’t have any use for this one. Comes with box and phone only,3,Local pickup (9 miles away),No shipping INFO!,9.0,,,"San Diego, CA",San Diego, CA,2 weeks 
383,780641279,Louis Vuitton iphone 7 8 plus case 100%Authentic date code,110,Used (normal wear),With date code 100% Authentic ,1,Local pickup (43 miles away),No shipping INFO!,43.0,,,"Temecula, CA",Temecula, CA,2 weeks 
384,780542158,Iphone 7 Plus - Apple Watch 3,400,Used (normal wear),"Iphone 7 Plus - $250 Works perfectly fine. Comes  with original box. I can even throw in a charger! Apple Watch 3 - $250Works perfectly fine. It is in brand new condition. Only wore it for a couple months, and just put it back in the box. Comes with original box and original chargerNO PAYPAL ",5,Local pickup (20 miles away),Ships for $10.99,20.0,,10.99,"El Cajon, CA",El Cajon, CA,2 weeks 
385,464616577,Apple iPhone 7 256GB AT&T Black - 3PA,504.99,Reconditioned/Certified,All items in the store have been fully tested and working properly. They come with a 15 day money back guarantee and a 90 day warranty.,2,Local pickup (44 miles away),No shipping INFO!,44.0,,,"Temecula, CA",Temecula, CA,2 weeks 
386,780415380,Apple iPhone 7 - 128GB - jet black,210,Used (normal wear),( Unlocked )New screen replaced by appleWorks with all carriers ,2,Local pickup (22 miles away),No shipping INFO!,22.0,,,"San Marcos, CA",San Marcos, CA,2 weeks 
387,652369649,iPhone 7,180,New (never used),Great ,2,Local pickup (13 miles away),No shipping INFO!,13.0,,,"La Mesa, CA",La Mesa, CA,2 weeks 
388,780369929,iPhone 7 unlocked 128gb,275,Used (normal wear),iCloud unlocked Cash only ,2,Local pickup (5 miles away),No shipping INFO!,5.0,,,"San Diego, CA",San Diego, CA,2 weeks 
389,780228532,iphone 7 256gb,280,New (never used),Christmas is coming up and do you need to give someone a phone for christmas well this is the one the phone has 256 gb of storage also comes with otterbox case factory unlocked i paid $900 for this brand new at the apple store$280 or best offer!!! ,2,Local pickup (9 miles away),No shipping INFO!,9.0,,,"San Diego, CA",San Diego, CA,2 weeks 
390,779964357,iPhone 7 Att 32Gb,175,Used (normal wear),Nice iPhone 7 only has minor scratches and dents on the sides but perfect phone . ,7,Local pickup (12 miles away),No shipping INFO!,12.0,,,"Coronado, CA",Coronado, CA,2 weeks 
391,779882256,Unlocked 32 gb iPhone 7,175,Used (normal wear),No description. Ask seller for more details,3,Local pickup (20 miles away),No shipping INFO!,20.0,,,"Chula Vista, CA",Chula Vista, CA,2 weeks 
393,779783052,iPhone 7,200,Used (normal wear),EVERYTHING WORKS GREAT iPhone 7 32 gUnlock Work for att and cricket ,5,Local pickup (15 miles away),No shipping INFO!,15.0,,,"Lincoln Acres, CA",Lincoln Acres, CA,2 weeks 
394,779625089,Iphone 7 (Unlocked),225,Used (normal wear),"Condition: Pre-OwnedSelling this clean Black Iphone 7. this IPhone is in really really good conditions. no hits, no dings, no chips and no scratches. Since the day that was bought, its allways been in a otterbox/lifeproof case. Took out of the case just tk show on pictures how clean it is. Was going to include cases but didnt because they are kind of used. Its really neat and well taken care of. Ready to use. Unlocked to any carrier. you can make it any carrier you want. Nothings wrong with the phone. works perfectly, the reason im selling is because I upgraded to another phone. so im not using it no more. Comes with charger cable, cube and earphones. The earphones are practically new, only used like 8 times. I have airpods so i dont use them. Asking $225 or better offer. OBO! I also accept trades. make me some offers, show me what you got, price negotiable. DM for more info. Check my other posts, thanks.",4,Local pickup (24 miles away),Ships for $3.29,24.0,,3.29,"San Diego, CA",San Diego, CA,2 weeks 
395,779515057,iPhone 7 Plus,150,Reconditioned/Certified,Won’t charge as is does not turn on ,2,Local pickup (15 miles away),No shipping INFO!,15.0,,,"Encinitas, CA",Encinitas, CA,2 weeks 
396,779282744,iPhone 7 with sprint,200,Used (normal wear),Crack on the bottom right shown in the picture ,4,Local pickup (27 miles away),Ships for $3.29,27.0,,3.29,"Oceanside, CA",Oceanside, CA,2 weeks 
397,779074355,IPHONE 7 32GB Factory Unlocked Any Carrier,215,Used (normal wear),"Good Battery Life and Clean IMEI, not reported stolen. We offer warranty on all of our phones.All of our phones are used but in great Shape! Factory unlocked which means you can put any Sim Card  with service and it will work.Comes with:House Charger Buy with confidence ",4,Local pickup (15 miles away),No shipping INFO!,15.0,,,"National City, CA",National City, CA,2 weeks 
398,778896944,iPhone 7 Plus,300,Reconditioned/Certified,"Brand new screen and brand new battery, works perfect, I bought this brand new from the Apple store, unblocked from every carrier, 256 gigs, I have the iPhone 10smax now so I have no use for it. When I had it it was always in the case.  ",5,Local pickup (49 miles away),No shipping INFO!,49.0,,,"Mission Viejo, CA",Mission Viejo, CA,2 weeks 
399,778746411,unlock iPhone 7 32gb perfect,225,Used (normal wear),"ICloud removed.phone is unlock for any sim card including overseas sim card no cracks or scratches, been kept in a case and a temper glass screeniphone  7 32gb black everything works perfect .perfect phone to have.only serious buyers and no trades.thank youbest offer takes it",3,Local pickup (16 miles away),No shipping INFO!,16.0,,,"San Diego, CA",San Diego, CA,2 weeks 
401,778346604,Note 9 unlocked 128gb,449,Used (normal wear),"Mint Condition Works With any AT&T , Tmobile, Verizon, Cricket, Metro Network and Overseas.We have in stock, iPhone 6 - $150  | iPhone 7 - $249  | iPhone 7 Plus - $349iPhone 8 - $349  | iPhone 8 Plus - $449 Samsung S8 - $249 |   S8 Plus - $349Samsung S9 - $349 |   S9 Plus  - $399Samsung Note 8 - $349  |  Note 9 - $449 Comes with warranty Call us or stop by  Our store address :Payless Wireless6074 EL Cajon Blvd San Diego, CA - 92115",5,Local pickup (16 miles away),No shipping INFO!,16.0,,,"Spring Valley, CA",Spring Valley, CA,2 weeks 
402,778325112,iPhone 7 Plus AT&T 32 g,250,New (never used),Phone is iPhone 7plus 32g for att great condition,2,Local pickup (13 miles away),No shipping INFO!,13.0,,,"Santee, CA",Santee, CA,2 weeks 
403,778191902,IPhone 7 128gb silver,250,Used (normal wear),"Great condition, all original. No low ballers. I don’t need to sell. Prefer to meet in Verizon store",3,Local pickup (23 miles away),No shipping INFO!,23.0,,,"Harbison Canyon, CA",Harbison Canyon, CA,2 weeks 
404,777991688,iPhone 7,230,New (never used),iPhone 7 Good condition  Screen intact 128 GB ,2,Local pickup (15 miles away),No shipping INFO!,15.0,,,"San Diego, CA",San Diego, CA,2 weeks 
405,777814613,iPhone 7 Plus,250,Used (normal wear),iPhone 7 Plus has a small crack and 1 speaker doesn’t work well but still works great other than that good condition ,4,Local pickup (26 miles away),No shipping INFO!,26.0,,,"Oceanside, CA",Oceanside, CA,3 weeks 
406,777453455,iphone7 plus $$$150$$$ with passcode pin lock,150,Used (normal wear),iPhone 7 plus good condition screen is perfect and has a pin lock ,4,Local pickup (11 miles away),Ships for $3.29,11.0,,3.29,"San Diego, CA",San Diego, CA,3 weeks 
407,777170365,iPhone 7 Plus 32 GBS T-Mobile,220,Used (normal wear),Only used for about a month. Good to go! ,4,Local pickup (11 miles away),No shipping INFO!,11.0,,,"San Diego, CA",San Diego, CA,3 weeks 
408,393209545,IPhone 7 matt black Sprint 32 gb,340,Used (normal wear),I got a new phone i dont need this one i want 400 come wit a offer we can talk it out just hit me up,3,Local pickup (20 miles away),No shipping INFO!,20.0,,,"El Cajon, CA",El Cajon, CA,3 weeks 
409,776381379,iPhone 7 Plus,350,Used (normal wear),Unblocked iPhone Gold color,2,Local pickup (11 miles away),No shipping INFO!,11.0,,,"San Diego, CA",San Diego, CA,3 weeks 
410,776733211,Rose Gold IPhone 7 Plus,300,Used (normal wear),Great condition there’s a slight crack and home button doesn’t push down all the way but works. 128 gb. Factory unlocked. 300 obo. NO LOWBALLS ,8,Local pickup (15 miles away),No shipping INFO!,15.0,,,"El Cajon, CA",El Cajon, CA,3 weeks 
